,Sentence
151,"Its views were supported at least in part by the California State Teachers’ Retirement System (CalSTRS) and hedge fund D.E. Shaw, which has $50 billion under management."
152,"In May, Exxon’s second-largest shareholder, BlackRock Inc, voted in favor of an independent chairman and against the re-election of two directors over Exxon’s approach to climate risks."
153,Exxon Mobil Corp on Wednesday said for the first time in a securities filing that some of its oil and gas properties may face impairment due to climate change.
154,The largest U.S. oil company’s board will test assets for climate impairments “in the context of overall enterprise risk” during the annual asset review by its board of directors.
155,"“Certain assets could be at risk for impairment,” it said."
156,Exxon’s 12-member board was overhauled in May with three new directors in a proxy battle that weighed heavily on the company’s past failure to address climate change.
157,Hedge fund Engine No.
158,1 was successful in convincing enough shareholders a new board could improve performance and rethink the energy transition strategy.
159,"The company for years has acknowledged risks to investment returns, demand and costs associated with climate change, and won a 2019 court fight against New York state’s Attorney General who alleged Exxon’s assessments failed to consider potential impairments for climate-related risks, a spokesperson said."
160,"Directors will analyze factors including future energy supply, regulation, government policies and greenhouse gas restrictions, the company said in the regulatory filing."
161,"Until asset recoverability assessments “are complete, it is not practicable to reasonably estimate the existence or range of potential future impairments,” Exxon said."
162,"The company “views climate change risks as a global issue that requires collaboration among governments, private companies, consumers and other stakeholders to create meaningful solutions,” the filing said."
163,"“It’s a welcome shift that ExxonMobil’s new board is forcing the company to face the reality that the climate crisis it helped cause and the transition to a clean energy economy will have major financial impacts on its assets and bottom line,” Ben Cushing, Campaign Manager for the environmental organization Sierra Club’s Fossil-Free Finance campaign said."
164,"Exxon on Friday promised to increase spending to $15 billion between 2022 and 2027 on measures to cut its carbon emissions, the largest budget among U.S. majors, in what was seen as a first climate strategy change under the new board."
165,"Exxon and other U.S. oil majors’ climate strategy relies developing from scratch new decarbonization technologies that are currently years away from becoming commercial, like carbon capture and hydrogen."
166,Top executives of the U.S. producers were grilled before Congress last month here for their communication strategy on global warming.
167,"They were also questioned for focusing their business on oil and gas production, while European producers have started to shift away from fossil fuels towards renewable sources of energy like solar and wind power."
168,"The top U.S. producers here have decided against investments in solar and wind power projects, with investors onboard."
169,(Reporting by Sabrina Valle Editing by Marguerita Choy)Exxon Mobil Corp (XOM.
170,"N) was suspended from advocacy group Climate Leadership Council (CLC) that looks to make policies to address climate change, the CLC said on Friday."
171,The move comes a little over a month after an Exxon lobbyist said the company supports a carbon tax publicly because the plan to curb climate change would never gain enough political support to be adopted.
172,"Exxon Chief Executive Officer Darren Woods had condemned the comments""."
173,"After careful consideration, we have decided to suspend ExxonMobil's membership in both the Council and Americans for Carbon Dividends, our advocacy arm,"" CLC CEO Greg Bertelsen said in a statement."
174,Exxon was a founding member of the group along with ConocoPhillips (COP.
175,"N), BP (BP."
176,"L), Shell (RDSa."
177,L) and Total (TTEF.
178,PA).
179,The CLC's decision marks a u-turn after it supported the oil major in June after the lobbyist's comments.
180,"Exxon said in a statement the CLC's decision was ""disappointing and counterproductive""."
181,"""It's more important than ever for organizations to work together to advance meaningful policy solutions to address shared challenges and society's net-zero ambitions,"" it said."
182,"The company said it would continue to be a part of the Alliance for Market Solutions, an organization that also works to try and reduce carbon pollution."
183,"The non-profit organization World Resources Institute (WRI), a CLC member, said Exxon was not aligned with the council's push to put a price on carbon as a key response to the climate crisis."
184,"""We welcome CLC's separation from Exxon,"" the institute's CEO, Ani Dasgupta, said in a note, while calling on companies to support a price on carbon in any future legislation that advances in Congress."
185,"""We urge all companies to re-examine their lobbying, political spending and participation in trade associations to ensure that their actions are fully aligned with their public statements on climate change,"" Dasgupta said."
